{
  "source_id": "ai-log-259643",
  "synthesized_at": "2026-01-07T06:45:22.000000Z",
  "synthesis_model": "anthropic/claude-opus-4.5",
  "cross_evaluation_analysis": {
    "evidence": {
      "agreements": [
        {
          "point": "Traceability is excellent with rigorous citation practice linking claims to specific documents, page numbers, and external URLs",
          "confidence": "high",
          "supporting_judges": [
            "google/gemini-3-pro-preview",
            "x-ai/grok-4.1-fast",
            "meta-llama/llama-4-maverick"
          ]
        },
        {
          "point": "Source diversity is exemplary, integrating internal strategic documents with external market data",
          "confidence": "high",
          "supporting_judges": [
            "google/gemini-3-pro-preview",
            "x-ai/grok-4.1-fast",
            "meta-llama/llama-4-maverick"
          ]
        },
        {
          "point": "Data coverage is comprehensive across market dynamics, financial metrics, operational risks, and competitor activity",
          "confidence": "high",
          "supporting_judges": [
            "google/gemini-3-pro-preview",
            "x-ai/grok-4.1-fast",
            "meta-llama/llama-4-maverick"
          ]
        },
        {
          "point": "Data validity is strong but appropriately flagged for reliance on simulated external links and low internal confidence (35-40%)",
          "confidence": "high",
          "supporting_judges": [
            "google/gemini-3-pro-preview",
            "x-ai/grok-4.1-fast",
            "meta-llama/llama-4-maverick"
          ]
        }
      ],
      "disagreements": [],
      "synthesis_note": "Complete convergence across all three judges on Evidence dimension with identical scores and rationales. However, evidence validation flagged 10 quotes as potentially not matching source verbatim. This represents a significant concern that was NOT addressed by any judge evaluation, suggesting the judges may have assessed citation practice without verifying actual quote accuracy. This omission warrants a confidence adjustment on traceability."
    },
    "assumptions": {
      "agreements": [
        {
          "point": "Limitations are acknowledged with brutal honesty regarding gaps in offtakers, outdated models, and interconnection uncertainty",
          "confidence": "high",
          "supporting_judges": [
            "google/gemini-3-pro-preview",
            "x-ai/grok-4.1-fast",
            "meta-llama/llama-4-maverick"
          ]
        },
        {
          "point": "Transparency is strong with explicit statements on ITC eligibility, confidence levels, and market drivers",
          "confidence": "high",
          "supporting_judges": [
            "google/gemini-3-pro-preview",
            "x-ai/grok-4.1-fast",
            "meta-llama/llama-4-maverick"
          ]
        },
        {
          "point": "Inflection points are defined with clear Go/No-Go thresholds for IRR and Payback, though sensitivity detail is lacking",
          "confidence": "high",
          "supporting_judges": [
            "google/gemini-3-pro-preview",
            "x-ai/grok-4.1-fast",
            "meta-llama/llama-4-maverick"
          ]
        },
        {
          "point": "Validation is planned/proposed rather than completed, appropriately scored below threshold",
          "confidence": "high",
          "supporting_judges": [
            "google/gemini-3-pro-preview",
            "x-ai/grok-4.1-fast",
            "meta-llama/llama-4-maverick"
          ]
        }
      ],
      "disagreements": [],
      "synthesis_note": "Complete convergence on Assumptions dimension. The validation sub-criterion at 3.67 is correctly identified as a critical driver failure. All judges appropriately recognized that validation steps are proposed but not executed, which is a material gap for decision confidence."
    },
    "scenarios": {
      "agreements": [
        {
          "point": "Sensitivity testing is recommended but not performed, correctly capping score at 2",
          "confidence": "high",
          "supporting_judges": [
            "google/gemini-3-pro-preview",
            "x-ai/grok-4.1-fast",
            "meta-llama/llama-4-maverick"
          ]
        },
        {
          "point": "Scenario depth is insufficient - strategic options described but financial scenarios (Base/Upside/Downside) not modeled",
          "confidence": "high",
          "supporting_judges": [
            "google/gemini-3-pro-preview",
            "x-ai/grok-4.1-fast",
            "meta-llama/llama-4-maverick"
          ]
        },
        {
          "point": "Tradeoffs are clearly articulated but remain qualitative rather than quantified",
          "confidence": "high",
          "supporting_judges": [
            "google/gemini-3-pro-preview",
            "x-ai/grok-4.1-fast",
            "meta-llama/llama-4-maverick"
          ]
        },
        {
          "point": "Time horizon addresses immediate through medium-term but lacks long-term (2030+) implications",
          "confidence": "high",
          "supporting_judges": [
            "google/gemini-3-pro-preview",
            "x-ai/grok-4.1-fast",
            "meta-llama/llama-4-maverick"
          ]
        }
      ],
      "disagreements": [],
      "synthesis_note": "Complete convergence on Scenarios dimension, which is the weakest area of the analysis. The lack of executed sensitivity testing and absence of modeled financial scenarios represent the most significant analytical gaps. Both scenario_depth (2.67) and sensitivity_testing (2) fail critical driver thresholds."
    },
    "decision": {
      "agreements": [
        {
          "point": "Decision framing is clear and MECE with three strategic options directly addressing the execution challenge",
          "confidence": "high",
          "supporting_judges": [
            "google/gemini-3-pro-preview",
            "x-ai/grok-4.1-fast",
            "meta-llama/llama-4-maverick"
          ]
        },
        {
          "point": "Logical flow is strong with clear narrative arc from Market Opportunity through to Recommendation",
          "confidence": "high",
          "supporting_judges": [
            "google/gemini-3-pro-preview",
            "x-ai/grok-4.1-fast",
            "meta-llama/llama-4-maverick"
          ]
        },
        {
          "point": "Conclusion clarity is unambiguous, time-bound, and actionable",
          "confidence": "high",
          "supporting_judges": [
            "google/gemini-3-pro-preview",
            "x-ai/grok-4.1-fast",
            "meta-llama/llama-4-maverick"
          ]
        },
        {
          "point": "Insight maturity is good but largely derivative of provided context rather than novel synthesis",
          "confidence": "high",
          "supporting_judges": [
            "google/gemini-3-pro-preview",
            "x-ai/grok-4.1-fast",
            "meta-llama/llama-4-maverick"
          ]
        }
      ],
      "disagreements": [],
      "synthesis_note": "Complete convergence on Decision dimension with the highest aggregate score (4.75). The recommendation is well-framed and clearly articulated. However, the strength of the decision framing may create false confidence given the underlying weaknesses in scenario analysis that support it."
    }
  },
  "synthesized_dis": {
    "recommendation": "Proceed with Option 1: Hybrid Partnership Execution for Q1 2026 launch, CONDITIONAL on completing sensitivity analysis and financial scenario modeling within 30 days to validate the recommendation's robustness.",
    "what_we_did": "Validated the market opportunity by analyzing PJM capacity price surges (~$29 to ~$270/MW-day), assessed internal readiness gaps across hiring, interconnection, and financial modeling capabilities, and compared three execution models (Hybrid Partnership, Internal Vertical Build, Acquisition) against the Q1 2026 deadline constraint.",
    "what_we_tested": "Evaluated three strategic pathways against criteria of speed-to-market, risk profile, and operational flexibility. Compared market drivers and value propositions in Illinois (capacity-focused) versus New York (energy arbitrage-focused). Assessed internal confidence levels (35-40%) and identified specific validation gaps.",
    "risks_acknowledged": "Interconnection queue saturation in target cities (Chicago, NYC); local opposition regarding fire safety concerns; economic uncertainty reflected in low internal confidence (35-40%); regulatory volatility in both PJM and NYISO markets; lack of secured offtakers; outdated financial models requiring refresh; ITC eligibility assumptions not yet validated.",
    "why_this_path": "Hybrid model is the only pathway enabling Q1 2026 launch by leveraging partner capabilities for interconnection and development expertise. Internal vertical build faces 6-12 month hiring lag making Q1 2026 impossible. Acquisition pathway is too costly and complex for timeline. Status quo (delay) risks missing the current capacity price window which may not persist. However, this recommendation rests on unvalidated financial assumptions.",
    "unresolved_risks": [
      "No sensitivity analysis performed to test recommendation robustness under variable conditions",
      "Financial scenarios (Base/Upside/Downside) not modeled for Option 1 vs alternatives",
      "10 evidence quotes flagged as potentially not matching source documents verbatim",
      "Partner availability and terms for Hybrid model not validated",
      "Long-term (2030+) strategic implications not analyzed",
      "Quantified tradeoffs between options not provided"
    ],
    "recommendation_confidence": "high",
    "recommendation_conflicts": []
  },
  "final_easd_scores": {
    "evidence": {
      "source_diversity": {
        "score": 4,
        "judge_scores": [
          {
            "judge": "google/gemini-3-pro-preview",